{
  "schema_version": "0",
  "template_id": "synth_job_application_en",
  "source_url": "https://github.com/hemish22/IndicFormBench/blob/main/src/generate/synth_table_forms.py",
  "licence": "other",
  "language": "english",
  "fillable": false,
  "checkboxes": [
    {"id": "cb_gender_male", "bbox": [312, 738, 37, 37], "label_text": "Male", "label_script": "latin", "group": "gender", "page": 0},
    {"id": "cb_gender_female", "bbox": [473, 738, 37, 37], "label_text": "Female", "label_script": "latin", "group": "gender", "page": 0},
    {"id": "cb_gender_transgender", "bbox": [669, 738, 37, 37], "label_text": "Transgender", "label_script": "latin", "group": "gender", "page": 0}
  ],
  "fields": [
    {"id": "f_applicant_name", "label_text": "Name of Applicant", "label_script": "latin", "value_bbox": [437, 294, 1106, 46], "value_type": "name", "page": 0},
    {"id": "f_father_husband_name", "label_text": "Father's / Husband's Name", "label_script": "latin", "value_bbox": [555, 382, 988, 46], "value_type": "name", "page": 0},
    {"id": "f_dob", "label_text": "Date of Birth", "label_script": "latin", "value_bbox": [361, 470, 1182, 46], "value_type": "date", "page": 0},
    {"id": "f_mobile", "label_text": "Mobile No.", "label_script": "latin", "value_bbox": [339, 556, 503, 55], "value_type": "phone", "page": 0},
    {"id": "f_address", "label_text": "Address for Correspondence", "label_script": "latin", "value_bbox": [577, 642, 966, 46], "value_type": "address", "page": 0},
    {"id": "f_place", "label_text": "Place", "label_script": "latin", "value_bbox": [269, 1826, 1274, 46], "value_type": "city", "page": 0},
    {"id": "f_date", "label_text": "Date", "label_script": "latin", "value_bbox": [257, 1914, 1286, 46], "value_type": "date", "page": 0}
  ],
  "tables": [
    {"id": "tbl_education", "bbox": [110, 874, 1434, 452], "page": 0, "row_fill": "prefix", "cells": [{"row": 0, "col": 0, "rowspan": 2, "colspan": 1, "text": "Examination"}, {"row": 0, "col": 1, "rowspan": 2, "colspan": 1, "text": "Board / University"}, {"row": 0, "col": 2, "rowspan": 2, "colspan": 1, "text": "Year of Passing"}, {"row": 0, "col": 3, "rowspan": 1, "colspan": 3, "text": "Marks"}, {"row": 1, "col": 3, "rowspan": 1, "colspan": 1, "text": "Obtained"}, {"row": 1, "col": 4, "rowspan": 1, "colspan": 1, "text": "Maximum"}, {"row": 1, "col": 5, "rowspan": 1, "colspan": 1, "text": "Percentage"}, {"row": 2, "col": 0, "rowspan": 1, "colspan": 1, "text": "10th (Secondary)"}, {"row": 2, "col": 1, "rowspan": 1, "colspan": 1, "text": null, "bbox": [408, 998, 404, 68], "value_type": "board"}, {"row": 2, "col": 2, "rowspan": 1, "colspan": 1, "text": null, "bbox": [828, 998, 154, 68], "value_type": "year"}, {"row": 2, "col": 3, "rowspan": 1, "colspan": 1, "text": null, "bbox": [998, 998, 164, 68], "value_type": "marks"}, {"row": 2, "col": 4, "rowspan": 1, "colspan": 1, "text": null, "bbox": [1178, 998, 154, 68], "value_type": "max_marks"}, {"row": 2, "col": 5, "rowspan": 1, "colspan": 1, "text": null, "bbox": [1348, 998, 188, 68], "value_type": "percent"}, {"row": 3, "col": 0, "rowspan": 1, "colspan": 1, "text": "12th (Higher Secondary)"}, {"row": 3, "col": 1, "rowspan": 1, "colspan": 1, "text": null, "bbox": [408, 1082, 404, 68], "value_type": "board"}, {"row": 3, "col": 2, "rowspan": 1, "colspan": 1, "text": null, "bbox": [828, 1082, 154, 68], "value_type": "year"}, {"row": 3, "col": 3, "rowspan": 1, "colspan": 1, "text": null, "bbox": [998, 1082, 164, 68], "value_type": "marks"}, {"row": 3, "col": 4, "rowspan": 1, "colspan": 1, "text": null, "bbox": [1178, 1082, 154, 68], "value_type": "max_marks"}, {"row": 3, "col": 5, "rowspan": 1, "colspan": 1, "text": null, "bbox": [1348, 1082, 188, 68], "value_type": "percent"}, {"row": 4, "col": 0, "rowspan": 1, "colspan": 1, "text": "Graduation"}, {"row": 4, "col": 1, "rowspan": 1, "colspan": 1, "text": null, "bbox": [408, 1166, 404, 68], "value_type": "board"}, {"row": 4, "col": 2, "rowspan": 1, "colspan": 1, "text": null, "bbox": [828, 1166, 154, 68], "value_type": "year"}, {"row": 4, "col": 3, "rowspan": 1, "colspan": 1, "text": null, "bbox": [998, 1166, 164, 68], "value_type": "marks"}, {"row": 4, "col": 4, "rowspan": 1, "colspan": 1, "text": null, "bbox": [1178, 1166, 154, 68], "value_type": "max_marks"}, {"row": 4, "col": 5, "rowspan": 1, "colspan": 1, "text": null, "bbox": [1348, 1166, 188, 68], "value_type": "percent"}, {"row": 5, "col": 0, "rowspan": 1, "colspan": 1, "text": "Post Graduation"}, {"row": 5, "col": 1, "rowspan": 1, "colspan": 1, "text": null, "bbox": [408, 1250, 404, 68], "value_type": "board"}, {"row": 5, "col": 2, "rowspan": 1, "colspan": 1, "text": null, "bbox": [828, 1250, 154, 68], "value_type": "year"}, {"row": 5, "col": 3, "rowspan": 1, "colspan": 1, "text": null, "bbox": [998, 1250, 164, 68], "value_type": "marks"}, {"row": 5, "col": 4, "rowspan": 1, "colspan": 1, "text": null, "bbox": [1178, 1250, 154, 68], "value_type": "max_marks"}, {"row": 5, "col": 5, "rowspan": 1, "colspan": 1, "text": null, "bbox": [1348, 1250, 188, 68], "value_type": "percent"}]},
    {"id": "tbl_experience", "bbox": [110, 1432, 1434, 350], "page": 0, "row_fill": "prefix", "cells": [{"row": 0, "col": 0, "rowspan": 2, "colspan": 1, "text": "S.No."}, {"row": 0, "col": 1, "rowspan": 2, "colspan": 1, "text": "Name of Employer"}, {"row": 0, "col": 2, "rowspan": 2, "colspan": 1, "text": "Post Held"}, {"row": 0, "col": 3, "rowspan": 1, "colspan": 2, "text": "Period"}, {"row": 1, "col": 3, "rowspan": 1, "colspan": 1, "text": "From"}, {"row": 1, "col": 4, "rowspan": 1, "colspan": 1, "text": "To"}, {"row": 2, "col": 0, "rowspan": 1, "colspan": 1, "text": "1"}, {"row": 2, "col": 1, "rowspan": 1, "colspan": 1, "text": null, "bbox": [228, 1556, 504, 62], "value_type": "employer"}, {"row": 2, "col": 2, "rowspan": 1, "colspan": 1, "text": null, "bbox": [748, 1556, 328, 62], "value_type": "designation"}, {"row": 2, "col": 3, "rowspan": 1, "colspan": 1, "text": null, "bbox": [1092, 1556, 214, 62], "value_type": "date"}, {"row": 2, "col": 4, "rowspan": 1, "colspan": 1, "text": null, "bbox": [1322, 1556, 214, 62], "value_type": "date"}, {"row": 3, "col": 0, "rowspan": 1, "colspan": 1, "text": "2"}, {"row": 3, "col": 1, "rowspan": 1, "colspan": 1, "text": null, "bbox": [228, 1634, 504, 62], "value_type": "employer"}, {"row": 3, "col": 2, "rowspan": 1, "colspan": 1, "text": null, "bbox": [748, 1634, 328, 62], "value_type": "designation"}, {"row": 3, "col": 3, "rowspan": 1, "colspan": 1, "text": null, "bbox": [1092, 1634, 214, 62], "value_type": "date"}, {"row": 3, "col": 4, "rowspan": 1, "colspan": 1, "text": null, "bbox": [1322, 1634, 214, 62], "value_type": "date"}, {"row": 4, "col": 0, "rowspan": 1, "colspan": 1, "text": "3"}, {"row": 4, "col": 1, "rowspan": 1, "colspan": 1, "text": null, "bbox": [228, 1712, 504, 62], "value_type": "employer"}, {"row": 4, "col": 2, "rowspan": 1, "colspan": 1, "text": null, "bbox": [748, 1712, 328, 62], "value_type": "designation"}, {"row": 4, "col": 3, "rowspan": 1, "colspan": 1, "text": null, "bbox": [1092, 1712, 214, 62], "value_type": "date"}, {"row": 4, "col": 4, "rowspan": 1, "colspan": 1, "text": null, "bbox": [1322, 1712, 214, 62], "value_type": "date"}]}
  ]
}
