{
  "schema_version": "0",
  "template_id": "synth_household_bn",
  "source_url": "https://github.com/hemish22/IndicFormBench/blob/main/src/generate/synth_table_forms.py",
  "licence": "other",
  "language": "bengali",
  "fillable": false,
  "checkboxes": [
    {"id": "cb_category_general", "bbox": [271, 650, 37, 37], "label_text": "সাধারণ", "label_script": "bengali", "group": "category", "page": 0},
    {"id": "cb_category_obc", "bbox": [456, 650, 37, 37], "label_text": "ওবিসি", "label_script": "bengali", "group": "category", "page": 0},
    {"id": "cb_category_sc", "bbox": [627, 650, 37, 37], "label_text": "তফসিলি জাতি", "label_script": "bengali", "group": "category", "page": 0},
    {"id": "cb_category_st", "bbox": [896, 650, 37, 37], "label_text": "তফসিলি উপজাতি", "label_script": "bengali", "group": "category", "page": 0},
    {"id": "cb_house_kutcha", "bbox": [347, 726, 37, 37], "label_text": "কাঁচা", "label_script": "bengali", "group": "house_type", "page": 0},
    {"id": "cb_house_semi_pucca", "bbox": [499, 726, 37, 37], "label_text": "আধা-পাকা", "label_script": "bengali", "group": "house_type", "page": 0},
    {"id": "cb_house_pucca", "bbox": [727, 726, 37, 37], "label_text": "পাকা", "label_script": "bengali", "group": "house_type", "page": 0}
  ],
  "fields": [
    {"id": "f_head_name", "label_text": "পরিবারের প্রধানের নাম", "label_script": "bengali", "value_bbox": [469, 294, 1074, 46], "value_type": "name", "page": 0},
    {"id": "f_address", "label_text": "ঠিকানা", "label_script": "bengali", "value_bbox": [276, 382, 1267, 46], "value_type": "address", "page": 0},
    {"id": "f_mobile", "label_text": "মোবাইল নম্বর", "label_script": "bengali", "value_bbox": [358, 468, 503, 55], "value_type": "phone", "page": 0},
    {"id": "f_ration_card", "label_text": "রেশন কার্ড নম্বর", "label_script": "bengali", "value_bbox": [384, 554, 1159, 46], "value_type": "serial", "page": 0},
    {"id": "f_place", "label_text": "স্থান", "label_script": "bengali", "value_bbox": [240, 1612, 1303, 46], "value_type": "city", "page": 0},
    {"id": "f_date", "label_text": "তারিখ", "label_script": "bengali", "value_bbox": [269, 1700, 1274, 46], "value_type": "date", "page": 0}
  ],
  "tables": [
    {"id": "tbl_family_members", "bbox": [110, 866, 1434, 692], "page": 0, "row_fill": "prefix", "cells": [{"row": 0, "col": 0, "rowspan": 1, "colspan": 1, "text": "ক্রমিক নং"}, {"row": 0, "col": 1, "rowspan": 1, "colspan": 1, "text": "নাম"}, {"row": 0, "col": 2, "rowspan": 1, "colspan": 1, "text": "প্রধানের সাথে সম্পর্ক"}, {"row": 0, "col": 3, "rowspan": 1, "colspan": 1, "text": "বয়স"}, {"row": 0, "col": 4, "rowspan": 1, "colspan": 1, "text": "লিঙ্গ"}, {"row": 0, "col": 5, "rowspan": 1, "colspan": 1, "text": "পেশা"}, {"row": 1, "col": 0, "rowspan": 1, "colspan": 1, "text": "1"}, {"row": 1, "col": 1, "rowspan": 1, "colspan": 1, "text": null, "bbox": [228, 958, 404, 60], "value_type": "name"}, {"row": 1, "col": 2, "rowspan": 1, "colspan": 1, "text": null, "bbox": [648, 958, 254, 60], "value_type": "relation"}, {"row": 1, "col": 3, "rowspan": 1, "colspan": 1, "text": null, "bbox": [918, 958, 104, 60], "value_type": "age"}, {"row": 1, "col": 4, "rowspan": 1, "colspan": 1, "text": null, "bbox": [1038, 958, 174, 60], "value_type": "gender"}, {"row": 1, "col": 5, "rowspan": 1, "colspan": 1, "text": null, "bbox": [1228, 958, 308, 60], "value_type": "occupation"}, {"row": 2, "col": 0, "rowspan": 1, "colspan": 1, "text": "2"}, {"row": 2, "col": 1, "rowspan": 1, "colspan": 1, "text": null, "bbox": [228, 1034, 404, 60], "value_type": "name"}, {"row": 2, "col": 2, "rowspan": 1, "colspan": 1, "text": null, "bbox": [648, 1034, 254, 60], "value_type": "relation"}, {"row": 2, "col": 3, "rowspan": 1, "colspan": 1, "text": null, "bbox": [918, 1034, 104, 60], "value_type": "age"}, {"row": 2, "col": 4, "rowspan": 1, "colspan": 1, "text": null, "bbox": [1038, 1034, 174, 60], "value_type": "gender"}, {"row": 2, "col": 5, "rowspan": 1, "colspan": 1, "text": null, "bbox": [1228, 1034, 308, 60], "value_type": "occupation"}, {"row": 3, "col": 0, "rowspan": 1, "colspan": 1, "text": "3"}, {"row": 3, "col": 1, "rowspan": 1, "colspan": 1, "text": null, "bbox": [228, 1110, 404, 60], "value_type": "name"}, {"row": 3, "col": 2, "rowspan": 1, "colspan": 1, "text": null, "bbox": [648, 1110, 254, 60], "value_type": "relation"}, {"row": 3, "col": 3, "rowspan": 1, "colspan": 1, "text": null, "bbox": [918, 1110, 104, 60], "value_type": "age"}, {"row": 3, "col": 4, "rowspan": 1, "colspan": 1, "text": null, "bbox": [1038, 1110, 174, 60], "value_type": "gender"}, {"row": 3, "col": 5, "rowspan": 1, "colspan": 1, "text": null, "bbox": [1228, 1110, 308, 60], "value_type": "occupation"}, {"row": 4, "col": 0, "rowspan": 1, "colspan": 1, "text": "4"}, {"row": 4, "col": 1, "rowspan": 1, "colspan": 1, "text": null, "bbox": [228, 1186, 404, 60], "value_type": "name"}, {"row": 4, "col": 2, "rowspan": 1, "colspan": 1, "text": null, "bbox": [648, 1186, 254, 60], "value_type": "relation"}, {"row": 4, "col": 3, "rowspan": 1, "colspan": 1, "text": null, "bbox": [918, 1186, 104, 60], "value_type": "age"}, {"row": 4, "col": 4, "rowspan": 1, "colspan": 1, "text": null, "bbox": [1038, 1186, 174, 60], "value_type": "gender"}, {"row": 4, "col": 5, "rowspan": 1, "colspan": 1, "text": null, "bbox": [1228, 1186, 308, 60], "value_type": "occupation"}, {"row": 5, "col": 0, "rowspan": 1, "colspan": 1, "text": "5"}, {"row": 5, "col": 1, "rowspan": 1, "colspan": 1, "text": null, "bbox": [228, 1262, 404, 60], "value_type": "name"}, {"row": 5, "col": 2, "rowspan": 1, "colspan": 1, "text": null, "bbox": [648, 1262, 254, 60], "value_type": "relation"}, {"row": 5, "col": 3, "rowspan": 1, "colspan": 1, "text": null, "bbox": [918, 1262, 104, 60], "value_type": "age"}, {"row": 5, "col": 4, "rowspan": 1, "colspan": 1, "text": null, "bbox": [1038, 1262, 174, 60], "value_type": "gender"}, {"row": 5, "col": 5, "rowspan": 1, "colspan": 1, "text": null, "bbox": [1228, 1262, 308, 60], "value_type": "occupation"}, {"row": 6, "col": 0, "rowspan": 1, "colspan": 1, "text": "6"}, {"row": 6, "col": 1, "rowspan": 1, "colspan": 1, "text": null, "bbox": [228, 1338, 404, 60], "value_type": "name"}, {"row": 6, "col": 2, "rowspan": 1, "colspan": 1, "text": null, "bbox": [648, 1338, 254, 60], "value_type": "relation"}, {"row": 6, "col": 3, "rowspan": 1, "colspan": 1, "text": null, "bbox": [918, 1338, 104, 60], "value_type": "age"}, {"row": 6, "col": 4, "rowspan": 1, "colspan": 1, "text": null, "bbox": [1038, 1338, 174, 60], "value_type": "gender"}, {"row": 6, "col": 5, "rowspan": 1, "colspan": 1, "text": null, "bbox": [1228, 1338, 308, 60], "value_type": "occupation"}, {"row": 7, "col": 0, "rowspan": 1, "colspan": 1, "text": "7"}, {"row": 7, "col": 1, "rowspan": 1, "colspan": 1, "text": null, "bbox": [228, 1414, 404, 60], "value_type": "name"}, {"row": 7, "col": 2, "rowspan": 1, "colspan": 1, "text": null, "bbox": [648, 1414, 254, 60], "value_type": "relation"}, {"row": 7, "col": 3, "rowspan": 1, "colspan": 1, "text": null, "bbox": [918, 1414, 104, 60], "value_type": "age"}, {"row": 7, "col": 4, "rowspan": 1, "colspan": 1, "text": null, "bbox": [1038, 1414, 174, 60], "value_type": "gender"}, {"row": 7, "col": 5, "rowspan": 1, "colspan": 1, "text": null, "bbox": [1228, 1414, 308, 60], "value_type": "occupation"}, {"row": 8, "col": 0, "rowspan": 1, "colspan": 1, "text": "8"}, {"row": 8, "col": 1, "rowspan": 1, "colspan": 1, "text": null, "bbox": [228, 1490, 404, 60], "value_type": "name"}, {"row": 8, "col": 2, "rowspan": 1, "colspan": 1, "text": null, "bbox": [648, 1490, 254, 60], "value_type": "relation"}, {"row": 8, "col": 3, "rowspan": 1, "colspan": 1, "text": null, "bbox": [918, 1490, 104, 60], "value_type": "age"}, {"row": 8, "col": 4, "rowspan": 1, "colspan": 1, "text": null, "bbox": [1038, 1490, 174, 60], "value_type": "gender"}, {"row": 8, "col": 5, "rowspan": 1, "colspan": 1, "text": null, "bbox": [1228, 1490, 308, 60], "value_type": "occupation"}]}
  ]
}
