{
  "schema_version": "0",
  "template_id": "synth_household_hi",
  "source_url": "https://github.com/hemish22/IndicFormBench/blob/main/src/generate/synth_table_forms.py",
  "licence": "other",
  "language": "hindi",
  "fillable": false,
  "checkboxes": [
    {"id": "cb_category_general", "bbox": [263, 650, 37, 37], "label_text": "सामान्य", "label_script": "devanagari", "group": "category", "page": 0},
    {"id": "cb_category_obc", "bbox": [439, 650, 37, 37], "label_text": "अन्य पिछड़ा वर्ग", "label_script": "devanagari", "group": "category", "page": 0},
    {"id": "cb_category_sc", "bbox": [703, 650, 37, 37], "label_text": "अनुसूचित जाति", "label_script": "devanagari", "group": "category", "page": 0},
    {"id": "cb_category_st", "bbox": [965, 650, 37, 37], "label_text": "अनुसूचित जनजाति", "label_script": "devanagari", "group": "category", "page": 0},
    {"id": "cb_house_kutcha", "bbox": [384, 726, 37, 37], "label_text": "कच्चा", "label_script": "devanagari", "group": "house_type", "page": 0},
    {"id": "cb_house_semi_pucca", "bbox": [541, 726, 37, 37], "label_text": "अर्ध-पक्का", "label_script": "devanagari", "group": "house_type", "page": 0},
    {"id": "cb_house_pucca", "bbox": [753, 726, 37, 37], "label_text": "पक्का", "label_script": "devanagari", "group": "house_type", "page": 0}
  ],
  "fields": [
    {"id": "f_head_name", "label_text": "परिवार के मुखिया का नाम", "label_script": "devanagari", "value_bbox": [471, 294, 1072, 46], "value_type": "name", "page": 0},
    {"id": "f_address", "label_text": "पता", "label_script": "devanagari", "value_bbox": [236, 382, 1307, 46], "value_type": "address", "page": 0},
    {"id": "f_mobile", "label_text": "मोबाइल नंबर", "label_script": "devanagari", "value_bbox": [336, 468, 503, 55], "value_type": "phone", "page": 0},
    {"id": "f_ration_card", "label_text": "राशन कार्ड संख्या", "label_script": "devanagari", "value_bbox": [377, 554, 1166, 46], "value_type": "serial", "page": 0},
    {"id": "f_place", "label_text": "स्थान", "label_script": "devanagari", "value_bbox": [249, 1612, 1294, 46], "value_type": "city", "page": 0},
    {"id": "f_date", "label_text": "दिनांक", "label_script": "devanagari", "value_bbox": [265, 1700, 1278, 46], "value_type": "date", "page": 0}
  ],
  "tables": [
    {"id": "tbl_family_members", "bbox": [110, 866, 1434, 692], "page": 0, "row_fill": "prefix", "cells": [{"row": 0, "col": 0, "rowspan": 1, "colspan": 1, "text": "क्र.सं."}, {"row": 0, "col": 1, "rowspan": 1, "colspan": 1, "text": "नाम"}, {"row": 0, "col": 2, "rowspan": 1, "colspan": 1, "text": "मुखिया से संबंध"}, {"row": 0, "col": 3, "rowspan": 1, "colspan": 1, "text": "आयु"}, {"row": 0, "col": 4, "rowspan": 1, "colspan": 1, "text": "लिंग"}, {"row": 0, "col": 5, "rowspan": 1, "colspan": 1, "text": "व्यवसाय"}, {"row": 1, "col": 0, "rowspan": 1, "colspan": 1, "text": "1"}, {"row": 1, "col": 1, "rowspan": 1, "colspan": 1, "text": null, "bbox": [228, 958, 404, 60], "value_type": "name"}, {"row": 1, "col": 2, "rowspan": 1, "colspan": 1, "text": null, "bbox": [648, 958, 254, 60], "value_type": "relation"}, {"row": 1, "col": 3, "rowspan": 1, "colspan": 1, "text": null, "bbox": [918, 958, 104, 60], "value_type": "age"}, {"row": 1, "col": 4, "rowspan": 1, "colspan": 1, "text": null, "bbox": [1038, 958, 174, 60], "value_type": "gender"}, {"row": 1, "col": 5, "rowspan": 1, "colspan": 1, "text": null, "bbox": [1228, 958, 308, 60], "value_type": "occupation"}, {"row": 2, "col": 0, "rowspan": 1, "colspan": 1, "text": "2"}, {"row": 2, "col": 1, "rowspan": 1, "colspan": 1, "text": null, "bbox": [228, 1034, 404, 60], "value_type": "name"}, {"row": 2, "col": 2, "rowspan": 1, "colspan": 1, "text": null, "bbox": [648, 1034, 254, 60], "value_type": "relation"}, {"row": 2, "col": 3, "rowspan": 1, "colspan": 1, "text": null, "bbox": [918, 1034, 104, 60], "value_type": "age"}, {"row": 2, "col": 4, "rowspan": 1, "colspan": 1, "text": null, "bbox": [1038, 1034, 174, 60], "value_type": "gender"}, {"row": 2, "col": 5, "rowspan": 1, "colspan": 1, "text": null, "bbox": [1228, 1034, 308, 60], "value_type": "occupation"}, {"row": 3, "col": 0, "rowspan": 1, "colspan": 1, "text": "3"}, {"row": 3, "col": 1, "rowspan": 1, "colspan": 1, "text": null, "bbox": [228, 1110, 404, 60], "value_type": "name"}, {"row": 3, "col": 2, "rowspan": 1, "colspan": 1, "text": null, "bbox": [648, 1110, 254, 60], "value_type": "relation"}, {"row": 3, "col": 3, "rowspan": 1, "colspan": 1, "text": null, "bbox": [918, 1110, 104, 60], "value_type": "age"}, {"row": 3, "col": 4, "rowspan": 1, "colspan": 1, "text": null, "bbox": [1038, 1110, 174, 60], "value_type": "gender"}, {"row": 3, "col": 5, "rowspan": 1, "colspan": 1, "text": null, "bbox": [1228, 1110, 308, 60], "value_type": "occupation"}, {"row": 4, "col": 0, "rowspan": 1, "colspan": 1, "text": "4"}, {"row": 4, "col": 1, "rowspan": 1, "colspan": 1, "text": null, "bbox": [228, 1186, 404, 60], "value_type": "name"}, {"row": 4, "col": 2, "rowspan": 1, "colspan": 1, "text": null, "bbox": [648, 1186, 254, 60], "value_type": "relation"}, {"row": 4, "col": 3, "rowspan": 1, "colspan": 1, "text": null, "bbox": [918, 1186, 104, 60], "value_type": "age"}, {"row": 4, "col": 4, "rowspan": 1, "colspan": 1, "text": null, "bbox": [1038, 1186, 174, 60], "value_type": "gender"}, {"row": 4, "col": 5, "rowspan": 1, "colspan": 1, "text": null, "bbox": [1228, 1186, 308, 60], "value_type": "occupation"}, {"row": 5, "col": 0, "rowspan": 1, "colspan": 1, "text": "5"}, {"row": 5, "col": 1, "rowspan": 1, "colspan": 1, "text": null, "bbox": [228, 1262, 404, 60], "value_type": "name"}, {"row": 5, "col": 2, "rowspan": 1, "colspan": 1, "text": null, "bbox": [648, 1262, 254, 60], "value_type": "relation"}, {"row": 5, "col": 3, "rowspan": 1, "colspan": 1, "text": null, "bbox": [918, 1262, 104, 60], "value_type": "age"}, {"row": 5, "col": 4, "rowspan": 1, "colspan": 1, "text": null, "bbox": [1038, 1262, 174, 60], "value_type": "gender"}, {"row": 5, "col": 5, "rowspan": 1, "colspan": 1, "text": null, "bbox": [1228, 1262, 308, 60], "value_type": "occupation"}, {"row": 6, "col": 0, "rowspan": 1, "colspan": 1, "text": "6"}, {"row": 6, "col": 1, "rowspan": 1, "colspan": 1, "text": null, "bbox": [228, 1338, 404, 60], "value_type": "name"}, {"row": 6, "col": 2, "rowspan": 1, "colspan": 1, "text": null, "bbox": [648, 1338, 254, 60], "value_type": "relation"}, {"row": 6, "col": 3, "rowspan": 1, "colspan": 1, "text": null, "bbox": [918, 1338, 104, 60], "value_type": "age"}, {"row": 6, "col": 4, "rowspan": 1, "colspan": 1, "text": null, "bbox": [1038, 1338, 174, 60], "value_type": "gender"}, {"row": 6, "col": 5, "rowspan": 1, "colspan": 1, "text": null, "bbox": [1228, 1338, 308, 60], "value_type": "occupation"}, {"row": 7, "col": 0, "rowspan": 1, "colspan": 1, "text": "7"}, {"row": 7, "col": 1, "rowspan": 1, "colspan": 1, "text": null, "bbox": [228, 1414, 404, 60], "value_type": "name"}, {"row": 7, "col": 2, "rowspan": 1, "colspan": 1, "text": null, "bbox": [648, 1414, 254, 60], "value_type": "relation"}, {"row": 7, "col": 3, "rowspan": 1, "colspan": 1, "text": null, "bbox": [918, 1414, 104, 60], "value_type": "age"}, {"row": 7, "col": 4, "rowspan": 1, "colspan": 1, "text": null, "bbox": [1038, 1414, 174, 60], "value_type": "gender"}, {"row": 7, "col": 5, "rowspan": 1, "colspan": 1, "text": null, "bbox": [1228, 1414, 308, 60], "value_type": "occupation"}, {"row": 8, "col": 0, "rowspan": 1, "colspan": 1, "text": "8"}, {"row": 8, "col": 1, "rowspan": 1, "colspan": 1, "text": null, "bbox": [228, 1490, 404, 60], "value_type": "name"}, {"row": 8, "col": 2, "rowspan": 1, "colspan": 1, "text": null, "bbox": [648, 1490, 254, 60], "value_type": "relation"}, {"row": 8, "col": 3, "rowspan": 1, "colspan": 1, "text": null, "bbox": [918, 1490, 104, 60], "value_type": "age"}, {"row": 8, "col": 4, "rowspan": 1, "colspan": 1, "text": null, "bbox": [1038, 1490, 174, 60], "value_type": "gender"}, {"row": 8, "col": 5, "rowspan": 1, "colspan": 1, "text": null, "bbox": [1228, 1490, 308, 60], "value_type": "occupation"}]}
  ]
}
